Title,Year,Link,Episodes,Aired,Aired_start,Aired_end,AiredOn,OriginalNetwork,Duration,Duration_min,ContentRating,RatingScore,RatingVotes,WatchPlatforms,Format,Genres,Tags,Director,Screenwriter,Ranked,Popularity,Watchers,Has_dubbing_prob,Has_dubbing_pred
Girlfriend Project Day 1: Behind the Scenes,2022,https://mydramalist.com/738195-girlfriend-project-day-1-behind-the-scenes,2,"Sep  9, 2022 - Sep 16, 2022","Sep  9, 2022","Sep 16, 2022",Friday,,6 min.,6,Not Yet Rated,7.9,34,,Drama Special,Documentary,"Behind The Scenes, (Vote tags)",,,38375,99999,34,0.32,0
Military Prosecutor Doberman: Training Log,2022,https://mydramalist.com/724797-military-prosecutor-doberman-training-log,1,"Mar 28, 2022","Mar 28, 2022",,,,1 hr. 6 min.,66,15+ - Teens 15 or older,7.8,151,,Drama Special,Drama,"Multiple Mains, (Vote tags)",,,38696,14775,151,0.32,0
Once Again Special,2022,https://mydramalist.com/740419-once-again-special,1,"Oct  6, 2022","Oct  6, 2022",,,,20 min.,20,Not Yet Rated,7.8,79,Viki,Drama Special,,"Video Reaction, (Vote tags)",,,38940,19797,79,0.42,0
New Love Playlist Prologue,2022,https://mydramalist.com/743847-new-love-playlist-prologue,1,"Nov 16, 2022","Nov 16, 2022",,,,15 min.,15,13+ - Teens 13 or older,7.8,78,,Drama Special,,(Vote tags),,,39206,20509,78,0.32,0
Color Rush 2: Making Film,2022,https://mydramalist.com/719487-color-rush-2-making-film,2,"Jan 21, 2022","Jan 21, 2022",,Friday,,3 min.,3,Not Yet Rated,7.7,65,Viki,Drama Special,Documentary,"Behind The Scenes, (Vote tags)",,,39374,20085,65,0.42,0
Ode to Our Youth,2022,https://mydramalist.com/744329-the-love-of-the-writing-contest-kid,2,"Dec 21, 2022 - Dec 22, 2022","Dec 21, 2022","Dec 22, 2022","Wednesday, Thursday",,1 hr. 8 min.,68,15+ - Teens 15 or older,7.7,18,,Drama Special,"Romance, Youth, Drama","Teenager Female Lead, Teenager Male Lead, Miniseries, First Love, Friendship, (Vote tags)",Kim U Hyeon,Hwang Yeon Su,39764,19029,18,0.32,0
First Love Again Special,2022,https://mydramalist.com/736521-first-love-again-special,1,"Mar, 2022","Mar, 2022",,,,60 min.,60,13+ - Teens 13 or older,7.6,66,Viki,Drama Special,Documentary,"Behind The Scenes, (Vote tags)",,,40229,19348,66,0.42,0
tvN O'PENing: The First Glance,2022,https://mydramalist.com/725743-drama-stage-2022-first-sight,1,"Jul 16, 2022","Jul 16, 2022",,Saturday,,1 hr. 11 min.,71,15+ - Teens 15 or older,7.6,21,,Drama Special,Drama,"Death Of A Fiancé, Age Gap [Drama Life], Age Gap [Real Life], Juvenile Delinquency, Car Accident, Death, (Vote tags)",Kim Hyuntak,Yoo Soo Mi,40510,99999,21,0.32,0
The Law Cafe Special,2022,https://mydramalist.com/737215-the-law-cafe-special,1,"Aug 30, 2022","Aug 30, 2022",,,,60 min.,60,15+ - Teens 15 or older,7.6,105,,Drama Special,Documentary,"Behind The Scenes, Interview, (Vote tags)",Lee Eun Jin,,40653,16152,105,0.32,0
Crazy Love: The Prologue of Great Change,2022,https://mydramalist.com/722681-crazy-love-the-prologue-of-great-change,1,"Mar  1, 2022","Mar  1, 2022",,Tuesday,,,,Not Yet Rated,7.5,17,,Drama Special,Documentary,"Behind The Scenes, (Vote tags)",,,41351,99999,17,0.32,0
We're Not Trash,2022,https://mydramalist.com/743249-we-re-not-trash,8,"Dec 12, 2022 - Jan  4, 2023","Dec 12, 2022","Jan  4, 2023","Monday, Wednesday",,12 min.,12,Not Yet Rated,7.5,159,,Standard Series,"Psychological, Romance, Youth","Depressed Male Lead, Bipolar Female Lead, Hot-tempered Female Lead, Mental Illness, Healing, Eccentric Female Lead, Depression, Bipolar Disorder, Environmental Issues, Mother-Daughter Relationship, (Vote tags)",,,41573,10917,159,0.32,0
"No, Thank You Season 2",2022,https://mydramalist.com/710989-no-thank-you-season-2,12,"Jan  8, 2022 - Mar 26, 2022","Jan  8, 2022","Mar 26, 2022",Saturday,,20 min.,20,15+ - Teens 15 or older,7.5,137,Viki,Standard Series,"Comedy, Romance, Life, Drama","Family Relationship, Web Series, Adapted From A Webtoon, (Vote tags)",Lee Gwang Young,,41627,11826,137,0.42,0
Dream Maker,2022,https://mydramalist.com/740227-dream-maker,8,"Jul  4, 2022","Jul  4, 2022",,,,10 min.,10,15+ - Teens 15 or older,7.5,14,,Standard Series,"Drama, Sci-Fi","Short Length Series, Miniseries, Web Series, (Vote tags)",Kim Seung Tae,,41798,19060,14,0.32,0
tvN O'PENing: Don’t Announce Your Husband’s Death,2022,https://mydramalist.com/726065-tvn-o-pening-babel-syndrome,1,"Jun 25, 2022","Jun 25, 2022",,Saturday,,1 hr. 20 min.,80,15+ - Teens 15 or older,7.4,43,,Drama Special,Drama,(Vote tags),Choi Dong Suk,Lim Soo Rim,42681,21166,43,0.32,0
Only You,2022,https://mydramalist.com/743961-only-you,2,"Nov 28, 2022 - Nov 30, 2022","Nov 28, 2022","Nov 30, 2022",,,14 min.,14,Not Yet Rated,7.4,107,,Standard Series,Life,"Dog, Healing, Animal, Mental Illness, Depression, Apartment Setting, Fall/Autumn Setting, Landlord/Landlady Supporting Character, Short Length Series, Agoraphobia, (Vote tags)",,,42710,15441,107,0.32,0
Us in Your Distance,2022,https://mydramalist.com/714837-us-in-your-distance,1,"Apr 19, 2022","Apr 19, 2022",,Tuesday,,1 hr. 7 min.,67,Not Yet Rated,7.2,13,,Drama Special,Drama,"Barista Female Lead, Barista Male Lead, Autistic Male Lead, Autism, (Vote tags)",,,45348,99999,13,0.32,0
tvN O'PENing: Find the 1st Prize,2022,https://mydramalist.com/722073-find-the-1st-prize,2,"Jun 18, 2022","Jun 18, 2022",,Saturday,,1 hr. 19 min.,79,15+ - Teens 15 or older,7.2,12,,Drama Special,Drama,"Miniseries, (Vote tags)",Park Hong Soo,Choi Si Eun,45456,99999,12,0.32,0
BReal Bro&Sis,2022,https://mydramalist.com/745391-breal-bro-sis,8,"Dec 15, 2022 - Feb  5, 2023","Dec 15, 2022","Feb  5, 2023",Thursday,,10 min.,10,Not Yet Rated,7.2,15,,Standard Series,"Comedy, Drama","Short Length Series, Brother-Sister Relationship, Miniseries, Web Series, Body Swap, (Vote tags)",,,45652,99999,15,0.32,0
Walk to Kwangya,2022,https://mydramalist.com/733525-walk-to-kwangya,4,"Jul 19, 2022 - Jul 30, 2022","Jul 19, 2022","Jul 30, 2022","Tuesday, Saturday",,12 min.,12,13+ - Teens 13 or older,7.2,125,,Drama Special,Romance,"Short Length Series, Miniseries, Web Series, Advertisement, (Vote tags)",,,46060,14972,125,0.32,0
Drama Special Season 13: Silence of the Lambs,2022,https://mydramalist.com/736219-drama-special-season-13-silence-of-the-lambs,1,"Dec 21, 2022","Dec 21, 2022",,Thursday,,1 hr. 4 min.,64,Not Yet Rated,7.2,50,Viki,Drama Special,"Military, Drama","Crime Against Morality, Sexual Violence, Workplace Violence, Former Athlete Female Lead, Army Captain Female Lead, Soldier Supporting Character, Soldier Female Lead, Soldier Male Lead, Sexual Harassment, Violence, (Vote tags)",Kim Soo Jin,Kang Han,46349,99999,50,0.42,0
Shinjikki,2022,https://mydramalist.com/718715-shinjikki,5,"Apr 10, 2022 - Apr 16, 2022","Apr 10, 2022","Apr 16, 2022",,,10 min.,10,Not Yet Rated,7.2,23,,Standard Series,"Romance, Drama, Fantasy","Mermaid Female Lead, Short Length Series, Miniseries, Web Series, (Vote tags)",Choi Jung Min,,46713,20046,23,0.32,0
tvN O'PENing: My Beautiful Apartment,2022,https://mydramalist.com/726073-tvn-o-pening-the-apartment-is-beautiful,1,"Jul  1, 2022","Jul  1, 2022",,Friday,,1 hr. 13 min.,73,15+ - Teens 15 or older,7.2,12,,Drama Special,Drama,(Vote tags),Jo Eun Sol,Lee Yi Young,46858,99999,12,0.32,0
Drama Special Season 13: Prism,2022,https://mydramalist.com/736209-drama-special-season-13-prism,1,"Dec  1, 2022","Dec  1, 2022",,Wednesday,,1 hr. 3 min.,63,Not Yet Rated,7.1,110,Viki,Drama Special,"Romance, Youth, Drama, Sports","Violence Against Children, Student Female Lead, Student Male Lead, School Setting, Ballet Dancer Female Lead, Ballet Dancer Male Lead, Teenager Female Lead, Teenager Male Lead, Rivalry, High School, (Vote tags)",Lee Dae Kyung,Wi Jae Hwa,47058,17898,110,0.42,0
Tell Me Sick,2022,https://mydramalist.com/728555-tell-me-sick,9,"Apr  1, 2022 - May 27, 2022","Apr  1, 2022","May 27, 2022",Friday,,12 min.,12,Not Yet Rated,7.1,12,,Standard Series,"Drama, Medical","Veterinary Nurse Supporting Character, Animal Rescue, Workplace Setting, Hospital Setting, Veterinarian Supporting Character, Veterinarian Female Lead, Veterinarian Male Lead, Doctor Supporting Character, Short Length Series, Doctor Female Lead, (Vote tags)",,,47357,99999,12,0.32,0
The Secret House,2022,https://mydramalist.com/719349-secret-house,124,"Apr 11, 2022 - Oct 10, 2022","Apr 11, 2022","Oct 10, 2022","Monday, Tuesday, Wednesday, Thursday, Friday",,30 min.,30,15+ - Teens 15 or older,7.1,197,"Amazon Prime Video, Viki",Standard Series,"Thriller, Romance, Drama","Lawyer Male Lead, Raised By An Uncle/Aunt, Involuntarily Missing Person, Death Of A Sister, Death Of A Mother, Prosecutor Male Lead, Doctor Female Lead, Cheerful Female Lead, Evil Female Lead, Badass Male Lead, (Vote tags)",Lee Min Soo,Won Young Ok,47875,7406,197,0.64,1
Man Goddess,2022,https://mydramalist.com/759631-man-goddess,8,"Dec 15, 2022 - Feb  5, 2023","Dec 15, 2022","Feb  5, 2023",,,6 min.,6,Not Yet Rated,7.1,45,,Standard Series,"Comedy, Romance, Youth, Fantasy","Roommates' Relationship, Short Length Series, Transmigration, Miniseries, Cohabitation, Web Series, Friendship, (Vote tags)",,,48128,21489,45,0.32,0
Have a Good Neighbor,2022,https://mydramalist.com/738245-seo-yi-chu,3,"Oct  4, 2022 - Nov 15, 2022","Oct  4, 2022","Nov 15, 2022",,,9 min.,9,Not Yet Rated,7.1,30,,Standard Series,"Romance, Drama","Social Worker Female Lead, Athlete Male Lead, Short Length Series, Popular Male Lead, Shy Female Lead, Badminton, Miniseries, Friends To Lovers, Web Series, Advertisement, (Vote tags)",,,48135,99999,30,0.32,0
tvN O'PENing: Death Deliverer,2022,https://mydramalist.com/726165-tvn-o-pening-the-underworld-rider,1,"Aug  5, 2022","Aug  5, 2022",,Friday,,1 hr. 15 min.,75,15+ - Teens 15 or older,7.1,19,,Drama Special,"Thriller, Comedy, Drama, Fantasy","Black Comedy, Death, Suicide, Suspense, (Vote tags)",,Hwang Seol Hun,48552,99999,19,0.32,0
tvN O'PENing: Babel Syndrome,2022,https://mydramalist.com/721051-babel-syndrome,1,"Jul 29, 2022","Jul 29, 2022",,Friday,,1 hr. 7 min.,67,15+ - Teens 15 or older,7.1,60,,Drama Special,"Thriller, Mystery, Drama","Epidemic, Slight Romance, Virus, First Love, Investigation, Suspense, (Vote tags)",Chae Doo Byeong,,48593,16307,60,0.32,0
tvN O'PENing: Stock of High School,2022,https://mydramalist.com/726167-tvn-o-pening-stock-of-high-school,1,"Jul 22, 2022","Jul 22, 2022",,Friday,,55 min.,55,Not Yet Rated,7.1,24,,Drama Special,Drama,(Vote tags),Kang Hee Ju,Park Kyung Hwa,48636,99999,24,0.32,0
Out of this World Girlfriend,2022,https://mydramalist.com/743965-out-of-this-world-girlfriend,2,"Nov 21, 2022 - Nov 23, 2022","Nov 21, 2022","Nov 23, 2022","Monday, Wednesday",,12 min.,12,Not Yet Rated,7,86,,Standard Series,"Thriller, Comedy, Youth, Sci-Fi","Student Male Lead, School Setting, Teenager Male Lead, Short Length Series, Miniseries, High School, Artificial Intelligence, Web Series, Romance, Suspense, (Vote tags)",,,48793,18364,86,0.32,0
2PM Campus,2022,https://mydramalist.com/745697-2pm-campus,4,"Dec  4, 2022 - Dec 14, 2022","Dec  4, 2022","Dec 14, 2022",,,20 min.,20,Not Yet Rated,7,90,,Standard Series,"Romance, Youth, Drama","Female Centered Plot, Lesbian Female Lead, Short Length Series, Lesbian Romance, LGBTQ+, Miniseries, Web Series, Friendship, (Vote tags)",,,48877,15657,90,0.32,0
"Why, All of a Sudden?",2022,https://mydramalist.com/729673-why-all-of-a-sudden,7,"May 20, 2022 - Sep 23, 2022","May 20, 2022","Sep 23, 2022",Friday,,7 min.,7,Not Yet Rated,7,10,,Standard Series,Comedy,"Short Length Series, Lovelyz, Unlucky Female Lead, Clumsy Female Lead, Miniseries, Web Series, (Vote tags)",,,49217,99999,10,0.32,0
I'm Done,2022,https://mydramalist.com/718755-i-m-done,6,"Jan  4, 2022 - Jan 21, 2022","Jan  4, 2022","Jan 21, 2022","Tuesday, Friday",,9 min.,9,Not Yet Rated,7,12,,Standard Series,"Comedy, Youth","Student Female Lead, Student Male Lead, School Setting, Young Adult Female Lead, Young Adult Male Lead, Short Length Series, COVID-19, University, Infectious Disease, Miniseries, (Vote tags)",,Kim Sa Ra,49369,99999,12,0.32,0
KlayCity - Re:Build the World,2022,https://mydramalist.com/722661-klaycity-re-build-the-world,3,"Feb 22, 2022 - Mar 28, 2022","Feb 22, 2022","Mar 28, 2022",,,3 min.,3,Not Yet Rated,7,46,,Drama Special,Sci-Fi,"Short Length Series, Future, Miniseries, (Vote tags)",,,49487,21374,46,0.32,0
Turned on by You,2022,https://mydramalist.com/728707-turned-on-by-you,6,"Apr 21, 2022 - May 26, 2022","Apr 21, 2022","May 26, 2022",Thursday,,8 min.,8,Not Yet Rated,7,72,,Standard Series,Romance,"Ex Comes Back, Short Length Series, Sexual Tension, Miniseries, Friends To Lovers, Web Series, Friendship, (Vote tags)",,,49489,20719,72,0.32,0
New Recruit,2022,https://mydramalist.com/711189-new-recruit,10,"Jul 22, 2022 - Aug  5, 2022","Jul 22, 2022","Aug  5, 2022",Friday,,30 min.,30,15+ - Teens 15 or older,7,15,,Standard Series,"Military, Comedy","Soldier Male Lead, Miniseries, Web Series, (Vote tags)",Min Jin Gi,"Kim Dan, Jangbbijju",50357,15352,15,0.32,0
Turned on by You Season 2,2022,https://mydramalist.com/746213-turned-on-by-you-season-2,7,"Dec 15, 2022 - Feb  2, 2023","Dec 15, 2022","Feb  2, 2023",,,10 min.,10,Not Yet Rated,7,15,,Standard Series,Romance,"Short Length Series, Miniseries, Web Series, (Vote tags)",,,50378,99999,15,0.32,0
Chart Running Scholar,2022,https://mydramalist.com/742391-chart-running-scholar,6,"Nov  8, 2022 - Dec 13, 2022","Nov  8, 2022","Dec 13, 2022",Tuesday,,14 min.,14,Not Yet Rated,6.9,105,,Standard Series,"Romance, Fantasy","Scholar Male Lead, Poor Female Lead, Miniseries, Web Series, Time Travel, Nice Male Lead, Short Length Series, Costume, Sisters' Relationship, School Violence, (Vote tags)",Lee Si Young,Sung Sang Min,50503,13074,105,0.32,0
Two Universes,2022,https://mydramalist.com/79987-two-universes,10,"Mar 17, 2022 - May 19, 2022","Mar 17, 2022","May 19, 2022",Thursday,,15 min.,15,15+ - Teens 15 or older,6.9,24,,Standard Series,"Romance, Drama","Fortune-telling, Miniseries, Web Series, Fate, Love Triangle, (Vote tags)",Lee Je Hee,Choi Soo Young,50853,10187,24,0.32,0
Drama Special Season 13: Self-Indulgence,2022,https://mydramalist.com/736207-drama-special-season-13-indulgence,1,"Nov 17, 2022","Nov 17, 2022",,Thursday,,1 hr. 5 min.,65,Not Yet Rated,6.9,129,Viki,Drama Special,"Drama, Supernatural","Antihero Male Lead, Live Streamer Supporting Character, Deliveryman Male Lead, Morally Ambiguous Male Lead, Supernatural Being, Abusive Boss, Poverty, Social Media, Social Satire, Supernatural Power, (Vote tags)",Choi Jung Eun,Wi Jae Hwa,50921,17518,129,0.42,0
The Witch's Eye,2022,https://mydramalist.com/736949-beauty,5,"Sep 29, 2022 - Oct 13, 2022","Sep 29, 2022","Oct 13, 2022","Tuesday, Thursday",,13 min.,13,Not Yet Rated,6.9,85,,Standard Series,"Romance, Drama, Fantasy","Karma, Past Life, Miniseries, Web Series, (Vote tags)",,,51236,13798,85,0.32,0
Convenience Store Junkies,2022,https://mydramalist.com/734247-convenience-store-junkies,20,"Jun 27, 2022 - Jul 22, 2022","Jun 27, 2022","Jul 22, 2022","Monday, Tuesday, Wednesday, Thursday, Friday",,1 min.,1,Not Yet Rated,6.9,57,,Standard Series,Drama,"Convenience Store Setting, Part-time Worker Female Lead, Short Length Series, Web Series, (Vote tags)",Kim Joon Mo,,51543,14903,57,0.29,0
Riding Dongdang,2022,https://mydramalist.com/743963-riding-dongdang,6,"Dec  1, 2022 - Jan  5, 2023","Dec  1, 2022","Jan  5, 2023",Thursday,,13 min.,13,Not Yet Rated,6.9,23,,Standard Series,"Comedy, Youth, Sports","Short Length Series, Cycling, Miniseries, Web Series, Coming Of Age, (Vote tags)",,,51686,99999,23,0.32,0
Is There Equation in Love?,2022,https://mydramalist.com/713405-is-there-equation-in-love,5,"Jul  8, 2022 - Aug  5, 2022","Jul  8, 2022","Aug  5, 2022",Friday,,15 min.,15,Not Yet Rated,6.9,85,,Standard Series,Romance,"Miniseries, Short Length Series, Web Series, Friendship, (Vote tags)",Han Da Weon,,51705,14360,85,0.32,0
You & It,2022,https://mydramalist.com/718743-you-it,8,"Jan  5, 2022 - Jan 28, 2022","Jan  5, 2022","Jan 28, 2022","Wednesday, Friday",,8 min.,8,G - All Ages,6.8,26,,Standard Series,"Romance, Sci-Fi","Short Length Series, Miniseries, Artificial Intelligence, Robot, (Vote tags)",,,51928,99999,26,0.32,0
Bubble Up,2022,https://mydramalist.com/680629-bubble-up,10,"Apr  4, 2022 - Apr  5, 2022","Apr  4, 2022","Apr  5, 2022",Monday,,15 min.,15,15+ - Teens 15 or older,6.8,148,Viki,Standard Series,"Romance, Life, Youth, Drama","Miniseries, Web Series, University, Emotionally Strong Female Lead, School Setting, Short Length Series, (Vote tags)",,,52284,13018,148,0.42,0
Anonymous High School Girl,2022,https://mydramalist.com/745189-anonymous-high-school-girl,5,"Dec 15, 2022 - Jan  3, 2023","Dec 15, 2022","Jan  3, 2023",Saturday,,8 min.,8,Not Yet Rated,6.8,102,,Standard Series,"Mystery, Romance, Youth, Drama","Secret Admirer Female Lead, Student Female Lead, School Setting, Teenager Female Lead, Lesbian Female Lead, Short Length Series, Lesbian Romance, Naive Female Lead, LGBTQ+, Miniseries, (Vote tags)",,,52314,14622,102,0.32,0
Themselves,2022,https://mydramalist.com/744201-themselves,3,"Nov 28, 2022 - Dec 26, 2022","Nov 28, 2022","Dec 26, 2022",Monday,,,,Not Yet Rated,6.8,54,,Standard Series,"Romance, Drama","Age Gap [Real Life], Miniseries, Older Woman/Younger Man, Web Series, Love Triangle, (Vote tags)",,,52614,14386,54,0.32,0
My Rocket Ship,2022,https://mydramalist.com/724657-my-rocket-ship,8,"Apr 14, 2022 - May 26, 2022","Apr 14, 2022","May 26, 2022",Thursday,,16 min.,16,Not Yet Rated,6.8,30,,Standard Series,"Business, Life, Youth, Drama","Startup, Entrepreneur Male Lead, Short Length Series, Chasing A Dream, Miniseries, Web Series, (Vote tags)",,,52703,14725,30,0.32,0
Tutorial,2022,https://mydramalist.com/727885-tutorial,4,"May 20, 2022 - May 31, 2022","May 20, 2022","May 31, 2022","Tuesday, Friday",,15 min.,15,Not Yet Rated,6.7,51,,Standard Series,Romance,"Workplace Setting, Office Setting, Office Worker Female Lead, Office Worker Male Lead, Short Length Series, Workplace Romance, Miniseries, Web Series, (Vote tags)",Kim Min Jun,,52957,15928,51,0.32,0
It's Rumored That She's a Woman Who Seduces Men at Work,2022,https://mydramalist.com/722629-it-s-rumored-that-she-s-a-woman-who-seduces-men-at-work,1,"Feb 16, 2022","Feb 16, 2022",,,,13 min.,13,Not Yet Rated,6.7,39,,Drama Special,Drama,"Workplace Violence, False Rumor, Workplace Setting, Office Worker Female Lead, Innocent Female Lead, Web Movie, Naive Female Lead, Short Film, Violence, Advertisement, (Vote tags)",,,53388,99999,39,0.32,0
Drama Special Season 13: Underwear Season,2022,https://mydramalist.com/736215-drama-special-season-13-panties-season,1,"Dec 14, 2022","Dec 14, 2022",,Thursday,,1 hr. 4 min.,64,15+ - Teens 15 or older,6.7,69,"Amazon Prime Video, Viki",Drama Special,"Comedy, Drama","Clothing Industry, Startup, Company President (CEO) Male Lead, Small Business, Smart Male Lead, (Vote tags)",Choi Jung Eun,Lee Ji Woo,53633,99999,69,0.67,1
The Summer Pasta Recipe: Making Clip,2022,https://mydramalist.com/740999-the-summer-pasta-recipe-making-clip,1,"Mar 28, 2022","Mar 28, 2022",,Monday,,2 min.,2,Not Yet Rated,6.7,10,,Drama Special,Documentary,"Behind The Scenes, (Vote tags)",,,53836,99999,10,0.32,0
Ply Friends: Seoyeon University Class of '22,2022,https://mydramalist.com/722069-friends-seoyeon-university-class-of-22,3,"Mar  4, 2022 - Mar 18, 2022","Mar  4, 2022","Mar 18, 2022",Friday,,12 min.,12,Not Yet Rated,6.5,12,,Standard Series,"Romance, Youth","Student Female Lead, Student Male Lead, Café Setting, Part-time Worker Female Lead, Part-time Worker Male Lead, Young Adult Female Lead, Young Adult Male Lead, Short Length Series, University, Miniseries, (Vote tags)",,,54904,99999,12,0.32,0
Dream Run Note,2022,https://mydramalist.com/727981-dream-run-note,1,"May 13, 2022","May 13, 2022",,Friday,,8 min.,8,13+ - Teens 13 or older,6.5,25,,Drama Special,"Romance, Youth","Student Female Lead, School Setting, Part-time Worker Female Lead, High School Crush, Web Movie, Poor Female Lead, High School, First Love, (Vote tags)",,,55177,99999,25,0.32,0
MBTI Love,2022,https://mydramalist.com/737599-mbti-love,3,"Sep  2, 2022 - Sep  7, 2022","Sep  2, 2022","Sep  7, 2022",,,11 min.,11,Not Yet Rated,6.5,27,,Standard Series,"Romance, Youth","Student Supporting Character, Student Female Lead, Student Male Lead, School Setting, Campus Setting, Young Adult Female Lead, Young Adult Male Lead, Short Length Series, University, Miniseries, (Vote tags)",,,55201,99999,27,0.32,0
Usual Yet Unusual,2022,https://mydramalist.com/727485-rare-but-uncommon,10,"Apr 30, 2022 - Jun  9, 2022","Apr 30, 2022","Jun  9, 2022",Thursday,,5 min.,5,15+ - Teens 15 or older,6.5,20,,Standard Series,"Romance, Drama","Friends With Benefits, Break Up, Sexual Tension, Miniseries, Heartbreak, Friends To Lovers, Web Series, Friendship, (Vote tags)",,,55232,99999,20,0.32,0
Moonstruck,2022,https://mydramalist.com/745553-moonstruck,1,"Dec 20, 2022","Dec 20, 2022",,Tuesday,,14 min.,14,Not Yet Rated,6.4,31,,Drama Special,"Life, Drama","Fan Female Lead, Brothers' Relationship, Web Movie, Family Relationship, Short Film, Traveling, (Vote tags)",,,55800,99999,31,0.32,0
Why Opposites Attract,2022,https://mydramalist.com/744627-why-opposites-attract,8,"Nov 21, 2022 - Jan  2, 2023","Nov 21, 2022","Jan  2, 2023",,,8 min.,8,Not Yet Rated,6.4,11,,Standard Series,,"Short Length Series, Miniseries, Web Series, (Vote tags)",,,55914,99999,11,0.32,0
The Girls on the Phone,2022,https://mydramalist.com/732783-the-girls-on-the-phone,9,"Jul 11, 2022 - Jul 18, 2022","Jul 11, 2022","Jul 18, 2022","Monday, Wednesday",,5 min.,5,Not Yet Rated,6.4,12,,Standard Series,"Comedy, Life, Youth, Drama","Workplace Setting, Best Friends' Relationship, Female Centered Plot, Short Length Series, Miniseries, Web Series, Friendship, (Vote tags)",,,55942,99999,12,0.32,0
Youn Hee's Love,2022,https://mydramalist.com/727791-yoonhee-s-romance,8,"May  5, 2022 - Jul 14, 2022","May  5, 2022","Jul 14, 2022",Thursday,,20 min.,20,Not Yet Rated,6.3,11,,Standard Series,Romance,"Miniseries, Web Series, Break Up, Infidelity, (Vote tags)",,,56045,99999,11,0.32,0
Ongoing Loved One,2022,https://mydramalist.com/733701-ongoing-loved-one,7,"Aug 26, 2022","Aug 26, 2022",,Friday,,15 min.,15,Not Yet Rated,6.3,13,,Standard Series,"Romance, Youth, Fantasy","Campus Setting, University, Friendship, Miniseries, Web Series, School Setting, COVID-19, Memory Manipulation, Infectious Disease, Memory Erasure, (Vote tags)",,,56226,13327,13,0.32,0
The Best Day,2022,https://mydramalist.com/725349-the-best-day,5,"Jan  7, 2022 - Feb  4, 2022","Jan  7, 2022","Feb  4, 2022",,,10 min.,10,Not Yet Rated,6.2,27,,Standard Series,"Romance, Drama","Workplace Setting, Office Setting, Short Length Series, Workplace Romance, Miniseries, Web Series, (Vote tags)",,,56494,99999,27,0.32,0
"Pro, Teen",2022,https://mydramalist.com/736951-pro-teen,10,"Sep  8, 2022 - Oct 13, 2022","Sep  8, 2022","Oct 13, 2022","Tuesday, Thursday",,12 min.,12,Not Yet Rated,6.2,22,,Standard Series,"Youth, Drama","Student Male Lead, School Setting, Teenager Male Lead, Chasing A Dream, Anthology, Miniseries, High School, Web Series, (Vote tags)",,,56691,13883,22,0.32,0
Loan to You,2022,https://mydramalist.com/744473-loan-to-you,3,"Dec  3, 2022 - Dec 17, 2022","Dec  3, 2022","Dec 17, 2022",Saturday,,6 min.,6,Not Yet Rated,5.7,11,,Standard Series,"Business, Comedy","Miniseries, Web Series, (Vote tags)",,,57527,99999,11,0.32,0
Drama for Anyone,2022,https://mydramalist.com/776319-drama-for-anyone,4,"Dec 29, 2022 - Jan 19, 2023","Dec 29, 2022","Jan 19, 2023",,,5 min.,5,Not Yet Rated,0,,,Standard Series,"Comedy, Drama","Short Length Series, Miniseries, Web Series, (Vote tags)",,,99999,99999,0,0.32,0
Convenience Store Newbie,2022,https://mydramalist.com/778034-convenience-store-newbie,15,"Dec 26, 2022 - Jan 13, 2023","Dec 26, 2022","Jan 13, 2023",,,1 min.,1,Not Yet Rated,0,,,Standard Series,Comedy,"Convenience Store Setting, Short Length Series, Web Series, (Vote tags)",,,99999,99999,0,0.32,0
Love Lock,2022,https://mydramalist.com/744097-love-lock,10,"Dec  9, 2022","Dec  9, 2022",,Friday,,10 min.,10,Not Yet Rated,0,,,Standard Series,Romance,"Short Length Series, Anthology, Miniseries, Web Series, (Vote tags)",,,99999,99999,0,0.32,0
Battle of Goyang Makgeolli,2022,https://mydramalist.com/738485-goyang-makgeolli-shooting-operation,1,"Dec  8, 2022","Dec  8, 2022",,Thursday,,1 hr. 29 min.,89,Not Yet Rated,0,,,Drama Special,,(Vote tags),Yoon Yeo Chang,Lee Sang Hwa,99999,99999,0,0.32,0
"Why, All of a Sudden? Season 2",2022,https://mydramalist.com/747037-why-all-of-a-sudden-season-2,8,"Dec  8, 2022 - Feb  9, 2023","Dec  8, 2022","Feb  9, 2023",Thursday,,7 min.,7,Not Yet Rated,0,,,Standard Series,Comedy,"Short Length Series, Sassy Female Lead, Miniseries, Web Series, Friendship, (Vote tags)",,,99999,99999,0,0.32,0
Soo Mi's House,2022,https://mydramalist.com/738249-soo-mi-s-house,4,"Dec  5, 2022 - Dec 26, 2022","Dec  5, 2022","Dec 26, 2022",,,10 min.,10,Not Yet Rated,0,,,Standard Series,Comedy,"Short Length Series, Miniseries, (Vote tags)",,,99999,99999,0,0.32,0
Dowdy Guys,2022,https://mydramalist.com/778214-dowdy-guys,16,"Nov 29, 2022 - Dec 23, 2022","Nov 29, 2022","Dec 23, 2022","Tuesday, Wednesday, Thursday, Friday",,1 min.,1,Not Yet Rated,0,,,Standard Series,Comedy,"Short Length Series, Web Series, (Vote tags)",,,99999,99999,0,0.32,0
VB Travel Agency,2022,https://mydramalist.com/750537-vb-travel-agency,18,"Nov 17, 2022 - Jan 13, 2023","Nov 17, 2022","Jan 13, 2023","Thursday, Friday",,7 min.,7,Not Yet Rated,6.3,3,,Standard Series,"Romance, Life","Travel Agent Female Lead, Travel Agent Male Lead, Short Length Series, Web Series, Friendship, (Vote tags)",,,99999,99999,3,0.29,0
Future Company Season 2,2022,https://mydramalist.com/743065-future-company-season-2,5,"Oct 25, 2022 - Nov 22, 2022","Oct 25, 2022","Nov 22, 2022",Tuesday,,19 min.,19,Not Yet Rated,0,,,Standard Series,Business,"Workplace Setting, Short Length Series, Miniseries, Web Series, (Vote tags)",,,99999,99999,0,0.32,0
