Title,Year,Link,Episodes,Aired,Aired_start,Aired_end,AiredOn,OriginalNetwork,Duration,Duration_min,ContentRating,RatingScore,RatingVotes,WatchPlatforms,Format,Genres,Tags,Director,Screenwriter,Ranked,Popularity,Watchers,Has_dubbing_prob,Has_dubbing_pred
Connection,2024,https://mydramalist.com/757315-connection,14,"May 24, 2024 - Jul  6, 2024","May 24, 2024","Jul  6, 2024","Friday, Saturday",,60 min.,60,15+ - Teens 15 or older,8.4,7127,"Apple TV+, Netflix, Viki",Standard Series,"Action, Thriller, Mystery, Crime","Drugging, Childhood Acquaintances Reuniting, Co-workers' Relationship, Childhood Friends' Relationship, Police Inspector Male Lead, Heir Male Lead, Cold Case, Detective Supporting Character, Company President (CEO) Supporting Character, Criminal Supporting Character, (Vote tags)","Kim Moon Kyo, Kwon Da Som",Lee Hyeon,671,1020,7127,1,1
Love in the Big City,2024,https://mydramalist.com/758821-love-in-the-big-city,8,"Oct 21, 2024","Oct 21, 2024",,Monday,,50 min.,50,18+ Restricted (violence & profanity),8.4,15599,"Netflix, Viki",Standard Series,"Romance, Youth, Drama","Gay Romance, Disapproving Parent, Tearjerker, Character Development, Friendship, Author Male Lead, Sad Romance, Heartbreak, Open-minded Female Lead, Lonely Male Lead, (Vote tags)","Hur Jin Ho, Hong Ji Young, Son Tae Gyum, Kim Se In",Park Sang Young,768,514,15599,1,1
The Atypical Family,2024,https://mydramalist.com/748581-although-i-am-not-a-hero,12,"May  4, 2024 - Jun  9, 2024","May  4, 2024","Jun  9, 2024","Saturday, Sunday",,1 hr. 10 min.,70,15+ - Teens 15 or older,8.4,34546,Netflix,Standard Series,"Comedy, Romance, Drama, Fantasy","Supernatural Power, Time Travel, Supernatural, Age Gap [Real Life], Older Man/Younger Woman, Rich Man/Poor Woman, Cunning Female Lead, Single Father Male Lead, Flashback To Past, Family Relationship, (Vote tags)",Jo Hyun Tak,Joo Hwa Mi,803,213,34546,1,1
Knight Flower,2024,https://mydramalist.com/743683-flowers-that-bloom-at-night,12,"Jan 12, 2024 - Feb 17, 2024","Jan 12, 2024","Feb 17, 2024","Friday, Saturday",,1 hr. 6 min.,66,Not Yet Rated,8.4,7372,"Amazon Prime Video, Apple TV+, Netflix, Viki",Standard Series,"Historical, Mystery, Comedy, Drama","Double Identity, Investigation, Widow Female Lead, Joseon Dynasty, Mother-in-law - Daughter-in-law Relationship, Brothers' Relationship, Corruption, Action, Age Gap [Drama Life], Skilled Fighter, (Vote tags)","Jang Tae Yoo, Choi Jung In",,817,1204,7372,1,1
Love for Love's Sake,2024,https://mydramalist.com/753495-love-supremacy-zone,8,"Jan 24, 2024 - Feb  1, 2024","Jan 24, 2024","Feb  1, 2024","Wednesday, Thursday",,34 min.,34,15+ - Teens 15 or older,8.4,22871,"Netflix, iQIYI",Standard Series,"Romance, Youth, Fantasy","Transmigration, Virtual World, LGBTQ+, Game World, Gay Romance, Adapted From A Webtoon, Fictional Character Supporting Character, Fictional Character Male Lead, Student Male Lead, School Setting, (Vote tags)",Kim Kyun Ah,Kwon Cho Rong,824,468,22871,1,1
Parasyte: The Grey,2024,https://mydramalist.com/732161-the-gray,6,"Apr  5, 2024","Apr  5, 2024",,Friday,,50 min.,50,18+ Restricted (violence & profanity),8.4,17064,Netflix,Standard Series,"Action, Mystery, Horror, Sci-Fi","Adapted From A Manga, Parasite, Gore, Violence, Supernatural Being, Survival, Investigation, Thriller, Conspiracy, Death, (Vote tags)",,Ryu Yong Jae,850,683,17064,1,1
My Sweet Mobster,2024,https://mydramalist.com/742271-the-woman-who-plays,16,"Jun 12, 2024 - Aug  1, 2024","Jun 12, 2024","Aug  1, 2024","Wednesday, Thursday",,1 hr. 6 min.,66,15+ - Teens 15 or older,8.3,20868,Viki,Standard Series,"Comedy, Romance","Opposites Attract, YouTuber Female Lead, Company President (CEO) Male Lead, Ex-Convict Male Lead, Age Gap [Drama Life], Age Gap [Real Life], Nice Female Lead, Second Chance, Childhood Connection, Cold Man/Warm Woman, (Vote tags)","Kim U Hyeon, Kim Young Hwan",Na Kyung,959,384,20868,0.66,1
Wonderful World,2024,https://mydramalist.com/749439-wonderful-world,14,"Mar  1, 2024 - Apr 13, 2024","Mar  1, 2024","Apr 13, 2024","Friday, Saturday",,1 hr. 10 min.,70,15+ - Teens 15 or older,8.3,8055,"Apple TV+, Disney+, Hulu",Standard Series,"Thriller, Mystery, Drama, Melodrama","News Presenter Male Lead, Healing, Death, Revenge, Suspense, Older Woman/Younger Man, Difficult Adulthood, Student Male Lead, Dropout Male Lead, Ex-Convict Female Lead, (Vote tags)",Lee Seung Young,Kim Ji Eun,1052,681,8055,1,1
The Time of Fever,2024,https://mydramalist.com/777367-the-time-of-fever,6,"Sep 12, 2024","Sep 12, 2024",,,,20 min.,20,15+ - Teens 15 or older,8.3,5633,iQIYI,Standard Series,"Romance, Drama","Student Male Lead, Secret Crush, High School, Childhood Friends' Relationship, Gay Male Lead, Friends Reunited, Gay Romance, Meet Again, Miniseries, Death Of A Father, (Vote tags)",Yang Kyung Hee,Shin Yoo,1054,1917,5633,0.56,0
Love Next Door,2024,https://mydramalist.com/758259-mom-s-friend-s-son,16,"Aug 17, 2024 - Oct  6, 2024","Aug 17, 2024","Oct  6, 2024","Saturday, Sunday",,1 hr. 20 min.,80,15+ - Teens 15 or older,8.3,57403,Netflix,Standard Series,"Comedy, Romance, Family","Childhood Connection, Friends To Lovers, Friendship, Meet Again, Successful Male Lead, Family Relationship, Mother-Daughter Relationship, Nice Male Lead, Sismance, Childhood Friends' Relationship, (Vote tags)",Yoo Je Won,Shin Ha Eun,1116,93,57403,1,1
The Auditors,2024,https://mydramalist.com/762223-thank-you,12,"Jul  6, 2024 - Aug 11, 2024","Jul  6, 2024","Aug 11, 2024","Saturday, Sunday",,1 hr. 10 min.,70,15+ - Teens 15 or older,8.3,3601,"Apple TV+, Netflix, Viki",Standard Series,"Action, Thriller, Mystery, Comedy","Auditor Supporting Character, Auditor Female Lead, Auditor Male Lead, Audit, Assistant Manager Supporting Character, Co-workers' Relationship, Workplace Setting, Workplace Politics, Office Setting, Senior-Junior Relationship, (Vote tags)",Kwon Young Il,Choi Min Ho,1144,2139,3601,1,1
The Player 2: Master of Swindlers,2024,https://mydramalist.com/733285-player-season-2,12,"Jun  3, 2024 - Jul  9, 2024","Jun  3, 2024","Jul  9, 2024","Monday, Tuesday",,60 min.,60,15+ - Teens 15 or older,8.2,2826,Viki,Standard Series,"Action, Thriller, Comedy, Crime","Loyal Male Lead, Driver Female Lead, Antihero Male Lead, Death, Revenge, Suspense, Emotionally Strong Female Lead, Emotionally Strong Male Lead, Teammates' Relationship, Villain Supporting Character, (Vote tags)","Go Jae Hyun, So Jae Hyun",Park Sang Moon,1246,2309,2826,0.61,1
"No Gain, No Love",2024,https://mydramalist.com/754711-because-i-want-no-loss,12,"Aug 26, 2024 - Oct  1, 2024","Aug 26, 2024","Oct  1, 2024","Monday, Tuesday",,1 hr. 8 min.,68,15+ - Teens 15 or older,8.2,31215,"Amazon Prime Video, Apple TV+",Standard Series,"Comedy, Romance, Drama","Contract Relationship, Foster Sisters' Relationship, Older Woman/Younger Man, Fake Marriage, Enemies To Lovers, Age Gap [Drama Life], Age Gap [Real Life], Contract Employee Male Lead, Voice Actor/Actress Supporting Character, Married Supporting Character, (Vote tags)",Kim Jung Shik,Kim Hye Young,1281,238,31215,1,1
Doctor Slump,2024,https://mydramalist.com/744311-doctor-slump,16,"Jan 27, 2024 - Mar 17, 2024","Jan 27, 2024","Mar 17, 2024","Saturday, Sunday",,1 hr. 5 min.,65,15+ - Teens 15 or older,8.2,41123,Netflix,Standard Series,"Comedy, Romance, Drama, Medical","Depression, Healing, Family Relationship, Rivals To Friends, Burnout Syndrome, Rivalry, Friends To Lovers, Meet Again, Friendship, Plastic Surgeon Male Lead, (Vote tags)",Oh Hyun Jong,Baek Sun Woo,1319,145,41123,1,1
Gyeongseong Creature Season 2,2024,https://mydramalist.com/742731-gyeongseong-creature-season-2,7,"Sep 27, 2024","Sep 27, 2024",,Friday,,48 min.,48,15+ - Teens 15 or older,8.2,13628,Netflix,Standard Series,"Action, Thriller, Historical, Sci-Fi","Monster, Drama, Supernatural, Horror, Suspense, Physically Strong Male Lead, Graphic Violence, Villain Supporting Character, Age Gap [Real Life], CGI, (Vote tags)",Jung Dong Yoon,Kang Eun Kyung,1431,760,13628,1,1
The Fiery Priest Season 2,2024,https://mydramalist.com/695965-the-fiery-priest-2,12,"Nov  8, 2024 - Dec 27, 2024","Nov  8, 2024","Dec 27, 2024","Friday, Saturday",,60 min.,60,15+ - Teens 15 or older,8.2,3777,Disney+,Standard Series,"Action, Comedy, Crime, Drama","Physically Strong Male Lead, Emotionally Strong Female Lead, Church Setting, Police Department Setting, Priest Male Lead, Monk/Nun Supporting Character, Drug Dealer Male Lead, Police Officer Female Lead, Detective Fiction, Age Gap [Real Life], (Vote tags)",Park Bo Ram,Park Jae Bum,1552,1798,3777,1,1
Crash,2024,https://mydramalist.com/718191-crash,12,"May 13, 2024 - Jun 18, 2024","May 13, 2024","Jun 18, 2024","Monday, Tuesday",,60 min.,60,15+ - Teens 15 or older,8.2,3845,"Disney+, Hulu",Standard Series,"Action, Thriller, Mystery, Comedy","Police Department Setting, Investigation, Teamwork, Teammates' Relationship, Co-workers' Relationship, Martial Artist Female Lead, Analyst Male Lead, Police Inspector Supporting Character, Senior-Junior Relationship, Chief Of Police Supporting Character, (Vote tags)",Park Joon Woo,,1639,1911,3845,1,1
Miss Night and Day,2024,https://mydramalist.com/755953-she-is-different-day-and-night,16,"Jun 15, 2024 - Aug  4, 2024","Jun 15, 2024","Aug  4, 2024","Saturday, Sunday",,1 hr. 10 min.,70,15+ - Teens 15 or older,8.2,17485,Netflix,Standard Series,"Mystery, Comedy, Romance, Fantasy","Double Identity, Investigation, Prosecutor Male Lead, Intern Female Lead, Unemployed Female Lead, Job Seeking, Father-Daughter Relationship, Mistaken Identity, Supportive Friend, Student Female Lead, (Vote tags)","Lee Hyung Min, Choi Sun Min",Park Ji Ha,1648,569,17485,1,1
Sweet Home Season 3,2024,https://mydramalist.com/731187-sweet-home-3,8,"Jul 19, 2024","Jul 19, 2024",,Friday,,52 min.,52,18+ Restricted (violence & profanity),8.1,20614,Netflix,Standard Series,"Action, Horror, Drama, Sci-Fi","Monster, Death, Gore, Apocalypse, Adapted From A Webtoon, Supernatural, Physically Strong Male Lead, Emotionally Strong Female Lead, Emotionally Strong Male Lead, Graphic Violence, (Vote tags)",Lee Eung Bok,Park So Jeong,1752,506,20614,1,1
Let Free the Curse of Taekwondo,2024,https://mydramalist.com/762027-uncovering-the-curse-of-taekwondo,8,"Oct 17, 2024 - Nov  7, 2024","Oct 17, 2024","Nov  7, 2024",Thursday,,35 min.,35,15+ - Teens 15 or older,8.1,11165,iQIYI,Standard Series,"Romance, Drama","Gay Romance, Lovers Reunited, Time Skip, Abusive Parent, Nonlinear Narrative, Taekwondo, Domestic Violence, Separated Lovers, Domestic Crime, Violence Against Children, (Vote tags)",,,1794,965,11165,0.51,0
What Comes after Love,2024,https://mydramalist.com/755807-things-that-come-after-love,6,"Sep 27, 2024 - Oct 25, 2024","Sep 27, 2024","Oct 25, 2024",Friday,,1 hr. 5 min.,65,13+ - Teens 13 or older,8.1,9886,Viki,Standard Series,"Romance, Melodrama","Intercountry Romance, Second Chance Romance, Adapted From A Novel, Partially Filmed Abroad, Studied Abroad, Lovers Reunited, Height Difference, Fate, Writer Male Lead, Star Crossed Lovers, (Vote tags)",Moon Hyun Sung,,1791,725,9886,0.56,0
Doubt,2024,https://mydramalist.com/759853-the-intimate-traitor,10,"Oct 11, 2024 - Nov 15, 2024","Oct 11, 2024","Nov 15, 2024","Friday, Saturday",,1 hr. 10 min.,70,15+ - Teens 15 or older,8.1,3790,"Apple TV+, Netflix, Viki",Standard Series,"Action, Thriller, Mystery, Psychological","Noir, Investigation, Suspense, Criminal Profiler Male Lead, Father-Daughter Relationship, Murder, Single Father Male Lead, Family, Miniseries, Student Female Lead, (Vote tags)",Song Yeon Hwa,,1835,1979,3790,1,1
Squid Game Season 2,2024,https://mydramalist.com/714529-squid-game-season-2,7,"Dec 26, 2024","Dec 26, 2024",,Thursday,,1 hr. 1 min.,61,18+ Restricted (violence & profanity),8.1,56442,Netflix,Standard Series,"Action, Thriller, Mystery, Drama","Death Game, Survival, Competition, Graphic Violence, Death, Suspense, Game, Transgender Female Lead, Social Commentary, Black Comedy, (Vote tags)",,,1966,141,56442,1,1
Love Your Enemy,2024,https://mydramalist.com/763553-love-on-a-single-log-bridge,12,"Nov 23, 2024 - Dec 29, 2024","Nov 23, 2024","Dec 29, 2024","Saturday, Sunday",,1 hr. 10 min.,70,15+ - Teens 15 or older,8.1,11396,"Disney+, Viki",Standard Series,"Comedy, Romance","Second Chance Romance, High School Sweethearts, Lovers Reunited, Disapproving Parent, Rival Families, Meet Again, Time Skip, High School, Forced Break-up, Chairman Male Lead, (Vote tags)",Park Joon Hwa,Im Ye Jin,2035,701,11396,1,1
Serendipity's Embrace,2024,https://mydramalist.com/735261-is-it-fate,8,"Jul 22, 2024 - Aug 13, 2024","Jul 22, 2024","Aug 13, 2024","Monday, Tuesday",,1 hr. 10 min.,70,15+ - Teens 15 or older,8.1,20373,Viki,Standard Series,"Comedy, Romance, Youth","Return From Abroad, Meet Again, Best Friends' Relationship, Animator Female Lead, Teacher Female Lead, Friendship, Teacher Supporting Character, First Love, Principal Supporting Character, Office Worker Female Lead, (Vote tags)",Song Hyun Wook,Park Geu Ro,2053,416,20373,0.61,1
A Virtuous Business,2024,https://mydramalist.com/766207-quiet-sales,12,"Oct 12, 2024 - Nov 17, 2024","Oct 12, 2024","Nov 17, 2024","Saturday, Sunday",,1 hr. 15 min.,75,15+ - Teens 15 or older,8.1,7603,Netflix,Standard Series,"Comedy, Romance, Life, Family","Female Centered Plot, Family Relationship, Friendship, Saleswoman Female Lead, Small Business, 1990s, Sex Industry, Return From Abroad, Poverty, Multiple Mains, (Vote tags)",Jo Woong,Choi Bo Rim,2058,1469,7603,1,1
The Whirlwind,2024,https://mydramalist.com/737003-whirlwind,12,"Jun 28, 2024","Jun 28, 2024",,Friday,,50 min.,50,15+ - Teens 15 or older,8,1394,Netflix,Standard Series,"Thriller, Mystery, Drama, Political","Political Intrigue, Power Struggle, Corruption, Suspense, Prime Minister Male Lead, (Vote tags)",Kim Yong Wan,Park Kyung Soo,2206,4046,1394,1,1
When the Phone Rings,2024,https://mydramalist.com/766179-the-number-you-have-dialed,12,"Nov 22, 2024 - Jan  4, 2025","Nov 22, 2024","Jan  4, 2025","Friday, Saturday",,1 hr. 8 min.,68,15+ - Teens 15 or older,8,55666,Netflix,Standard Series,"Thriller, Mystery, Romance, Drama","Contract Relationship, Arranged Marriage, Enemies To Lovers, Sign Language, Hidden Identity, Kidnapping, Age Gap [Drama Life], Revenge, Rich Family, Investigation, (Vote tags)","Park Sang Woo, Wi Deuk Gyu",Kim Ji Woon,2295,117,55666,1,1
The Midnight Studio,2024,https://mydramalist.com/749365-nightly-photo-studio,16,"Mar 11, 2024 - May  6, 2024","Mar 11, 2024","May  6, 2024","Monday, Tuesday",,60 min.,60,15+ - Teens 15 or older,8,7705,Viki,Standard Series,"Romance, Drama, Fantasy","Supernatural, Curse, Photographer Male Lead, Lawyer Female Lead, Ghost-seeing Male Lead, Lonely Male Lead, Passionate Female Lead, Affectionate Mains' Relationship, Ghost-seeing Female Lead, Bickering Mains' Relationship, (Vote tags)",Song Hyun Wook,Kim Yi Rang,2319,834,7705,0.56,0
Brewing Love,2024,https://mydramalist.com/766237-in-the-name-of-alcohol,12,"Nov  4, 2024 - Dec 10, 2024","Nov  4, 2024","Dec 10, 2024","Monday, Tuesday",,1 hr. 10 min.,70,15+ - Teens 15 or older,8,14539,Viki,Standard Series,"Comedy, Romance, Drama","Healing, Village Setting, Beer Brewing, Physically Strong Female Lead, Loyal Female Lead, Supportive Male Lead, Empathic Male Lead, Determined Female Lead, Hardworking Female Lead, Nice Male Lead, (Vote tags)",Park Seon Ho,Lee Jeong Sin,2354,494,14539,0.56,0
Blood Free,2024,https://mydramalist.com/731705-dominant-species,10,"Apr 10, 2024 - May  8, 2024","Apr 10, 2024","May  8, 2024",Wednesday,,50 min.,50,15+ - Teens 15 or older,8,5792,"Disney+, Hulu",Standard Series,"Thriller, Drama, Sci-Fi","Biotechnology, Artificial Intelligence, Food Industry, Genetic Engineering, Experiment, Bodyguard Male Lead, Rich Female Lead, Bodyguard Supporting Character, Company President (CEO) Female Lead, Multiple Mains, (Vote tags)",Park Cheol Hwan,Lee Su Yeon,2390,1318,5792,1,1
Captivating the King,2024,https://mydramalist.com/745731-spy,16,"Jan 21, 2024 - Mar  3, 2024","Jan 21, 2024","Mar  3, 2024","Saturday, Sunday",,1 hr. 10 min.,70,15+ - Teens 15 or older,8,6955,Netflix,Standard Series,"Historical, Romance, Drama, Melodrama","Political Intrigue, Hidden Identity, Palace Setting, Joseon Dynasty, Go Game, Revenge, Double Identity, Espionage, Power Struggle, Mystery, (Vote tags)",Jo Nam Gook,Kim Seon Deok,2574,1358,6955,1,1
Dog Knows Everything,2024,https://mydramalist.com/768211-nonsense,12,"Sep 25, 2024 - Oct 31, 2024","Sep 25, 2024","Oct 31, 2024","Wednesday, Thursday",,60 min.,60,15+ - Teens 15 or older,7.9,767,Viki,Standard Series,"Comedy, Drama, Sitcom","Slice Of Life, Character Development, Friendship, (Vote tags)",Kim Yu Jin,,2646,5492,767,0.56,0
"Dong Jae, the Good or the Bastard",2024,https://mydramalist.com/748115-good-or-bad-dong-jae,10,"Oct 10, 2024 - Nov  7, 2024","Oct 10, 2024","Nov  7, 2024",Thursday,,50 min.,50,15+ - Teens 15 or older,7.9,1076,,Standard Series,"Thriller, Mystery, Law, Drama","Prosecutor Male Lead, Murder, Investigation, Crime, Web Series, Suspense, Courtroom Setting, Corruption, Comedy, Satire, (Vote tags)",Park Geon Ho,"Hwang Ha Jeong, Kim Sang Won",2762,3706,1076,0.46,0
Missing Crown Prince,2024,https://mydramalist.com/760041-the-crown-prince-has-disappeared,20,"Apr 13, 2024 - Jun 16, 2024","Apr 13, 2024","Jun 16, 2024","Saturday, Sunday",,60 min.,60,15+ - Teens 15 or older,7.9,2690,Viki,Standard Series,"Historical, Comedy, Romance, Political","Age Gap [Real Life], Responsible Male Lead, Slight Mystery, Protective Male Lead, Warm Male Lead, Strangers To Lovers, Loyal Friend, Long Time Crush, Separated Lovers, Domestic Crime, (Vote tags)",Kim Jin Man,"Kim Ji Soo, Park Chul",2844,2247,2690,0.53,0
The Trunk,2024,https://mydramalist.com/748589-trunk,8,"Nov 29, 2024","Nov 29, 2024",,Friday,,1 hr. 3 min.,63,18+ Restricted (violence & profanity),7.9,18084,Netflix,Standard Series,"Mystery, Romance, Drama","Contract Relationship, Married Female Lead, Married Male Lead, Age Gap [Real Life], Feminism, Fake Marriage, Miniseries, Sexual Content, Nudity, Adapted From A Novel, (Vote tags)",Kim Kyu Tae,Park Eun Young,2850,501,18084,1,1
Gangnam B-Side,2024,https://mydramalist.com/747053-bulk,8,"Nov  6, 2024 - Nov 27, 2024","Nov  6, 2024","Nov 27, 2024",Wednesday,,50 min.,50,18+ Restricted (violence & profanity),7.9,7061,"Disney+, Hulu",Standard Series,"Action, Thriller, Mystery, Crime","Broker Male Lead, Hostess Female Lead, Police Officer Male Lead, Prosecutor Female Lead, Detective Male Lead, Drug Usage, Miniseries, Corruption, Web Series, Prostitution, (Vote tags)",,Jo Won Gyu,2867,1048,7061,1,1
Namib,2024,https://mydramalist.com/765155-namib,12,"Dec 23, 2024 - Jan 28, 2025","Dec 23, 2024","Jan 28, 2025","Monday, Tuesday",,60 min.,60,15+ - Teens 15 or older,7.9,3219,Viki,Standard Series,"Life, Drama","Married Supporting Character, Married Female Lead, Married Male Lead, Producer Supporting Character, Housewife/Househusband Supporting Character, Househusband Male Lead, Singer Male Lead, Company President (CEO) Female Lead, Talented Male Lead, Disabled Male Lead, (Vote tags)","Han Sang Jae, Kang Min Gu",,2966,1793,3219,0.56,0
Queen of Tears Special,2024,https://mydramalist.com/767771-queen-of-tears-special,2,"May  4, 2024 - May  5, 2024","May  4, 2024","May  5, 2024","Saturday, Sunday",,1 hr. 30 min.,90,15+ - Teens 15 or older,7.9,585,,Drama Special,Documentary,"Behind The Scenes, Interview, (Vote tags)",,,3035,7156,585,0.46,0
The Frog,2024,https://mydramalist.com/742729-in-the-forest-with-no-one,8,"Aug 23, 2024","Aug 23, 2024",,Friday,,58 min.,58,15+ - Teens 15 or older,7.9,11459,Netflix,Standard Series,"Thriller, Mystery, Psychological, Drama","Death, Murder, Suspense, Noir, (Vote tags)",Mo Wan Il,,3062,879,11459,1,1
Parole Examiner Lee,2024,https://mydramalist.com/751529-parole-officer-lee-han-shin,12,"Nov 18, 2024 - Dec 24, 2024","Nov 18, 2024","Dec 24, 2024","Monday, Tuesday",,60 min.,60,15+ - Teens 15 or older,7.9,1118,Viki,Standard Series,"Mystery, Law, Crime, Drama","Probation Officer Male Lead, Loan Shark Female Lead, Company President (CEO) Supporting Character, Attorney Supporting Character, Detective Female Lead, Revenge, Investigation, (Vote tags)",Yoon Sang Ho,Park Chi Hyeong,3131,4242,1118,0.56,0
A Killer Paradox,2024,https://mydramalist.com/729303-the-murderer-and-the-toy,8,"Feb  9, 2024","Feb  9, 2024",,Friday,,54 min.,54,18+ Restricted (violence & profanity),7.8,23697,Netflix,Standard Series,"Thriller, Mystery, Psychological, Supernatural","Black Comedy, Sexual Content, Morally Ambiguous Male Lead, Detective Male Lead, Dark Fiction, Nudity, Adapted From A Webtoon, Dog, Violence, Investigation, (Vote tags)",Lee Chang Hee,Kim Da Min,3245,341,23697,1,1
Face Me,2024,https://mydramalist.com/746011-look-at-me,12,"Nov  6, 2024 - Dec 12, 2024","Nov  6, 2024","Dec 12, 2024","Wednesday, Thursday",,55 min.,55,15+ - Teens 15 or older,7.8,4171,Viki,Standard Series,"Thriller, Mystery, Medical","Co-workers' Relationship, Suspense, Surgical Procedure, Ex-Convict Supporting Character, Death Of A Girlfriend, Death Of A Fiancée, Plastic Surgeon Supporting Character, Plastic Surgeon Male Lead, Surgeon Male Lead, Police Officer Supporting Character, (Vote tags)",Ahn Sang Hoon,Hwang Ye Jin,3310,1744,4171,0.56,0
Jazz for Two,2024,https://mydramalist.com/754665-jazz-for-two,8,"Mar 26, 2024 - Mar 29, 2024","Mar 26, 2024","Mar 29, 2024","Tuesday, Wednesday, Thursday, Friday",,30 min.,30,15+ - Teens 15 or older,7.8,17557,iQIYI,Standard Series,"Music, Romance, Youth","Gay Romance, Bully Male Lead, LGBTQ+, Pianist Male Lead, School Bullying, Adapted From A Webtoon, Transfer Student Male Lead, Aggressive Male Lead, Student Male Lead, School Setting, (Vote tags)",Kang Hye Rim,,3438,670,17557,0.51,0
Your Honor,2024,https://mydramalist.com/726979-your-honor,10,"Aug 12, 2024 - Sep 10, 2024","Aug 12, 2024","Sep 10, 2024","Monday, Tuesday",,1 hr. 10 min.,70,Not Yet Rated,7.8,1742,Viki,Standard Series,"Thriller, Law, Crime, Drama","Non-MDL Remake, Chairman Male Lead, Judge Male Lead, Criminal Organization, Miniseries, Father-Son Relationship, Death, Revenge, Murder, Suspense, (Vote tags)",Yoo Jong Sun,,3474,2665,1742,0.56,0
Dreaming of a Freaking Fairytale,2024,https://mydramalist.com/754061-she-dreams-of-cinderella,10,"May 31, 2024 - Jun 28, 2024","May 31, 2024","Jun 28, 2024",Friday,,42 min.,42,15+ - Teens 15 or older,7.8,13205,Amazon Prime Video,Standard Series,"Comedy, Romance","Rich Man/Poor Woman, Cinderella Complex, Cartoon Sound Effects, Selfish Female Lead, Age Gap [Real Life], Workplace Setting, Company President (CEO) Male Lead, Desperate Female Lead, Obsessive Female Lead, Gold-Digger Female Lead, (Vote tags)",Kim Min Kyung,Yoo Ja,3563,576,13205,0.71,1
Check in Hanyang,2024,https://mydramalist.com/749891-dohwa-gaekju,16,"Dec 21, 2024 - Feb  9, 2025","Dec 21, 2024","Feb  9, 2025","Saturday, Sunday",,1 hr. 10 min.,70,15+ - Teens 15 or older,7.8,3818,"Netflix, Viki",Standard Series,"Historical, Romance, Youth, Drama","Guest House Setting, Boarding House Setting, Historical Fiction, Joseon Dynasty, Cross-Dressing, Bromance, Friendship, Emotionally Strong Female Lead, Evil Parent, Intern Female Lead, (Vote tags)",Myung Hyun Woo,Park Hyun Jin,3612,1729,3818,1,1
Drama Special Season 15: To My Lonely Sister,2024,https://mydramalist.com/774469-drama-special-season-15-the-soles-are-hot,1,"Dec 10, 2024","Dec 10, 2024",,Tuesday,,60 min.,60,Not Yet Rated,7.8,282,Viki,Drama Special,Drama,"Responsible Female Lead, Student Female Lead, Social Anxiety Disorder, House Setting, Caregiver Female Lead, Neighbors' Relationship, Single Mother/Father Supporting Character, Unemployed Supporting Character, Teenager Female Lead, Depressed Female Lead, (Vote tags)",,,3614,11188,282,0.56,0
The Escape of the Seven: Resurrection,2024,https://mydramalist.com/750239-7-escape-season-2,16,"Mar 29, 2024 - May 18, 2024","Mar 29, 2024","May 18, 2024","Friday, Saturday",,1 hr. 10 min.,70,15+ - Teens 15 or older,7.8,2405,Viki,Standard Series,"Thriller, Mystery, Drama","Revenge, Betrayal, Suspense, Hatred, Picaresque, Secret, Survival, Investigation, Melodrama, Multiple Mains, (Vote tags)","O Jun Hyeok, Oh Song Hee",Kim Soon Ok,3766,2622,2405,0.56,0
Queen Woo,2024,https://mydramalist.com/720329-the-queen-woo,8,"Aug 29, 2024 - Sep 12, 2024","Aug 29, 2024","Sep 12, 2024",Thursday,,50 min.,50,18+ Restricted (violence & profanity),7.8,6170,"Apple TV+, Paramount+",Standard Series,"Action, Historical, Romance, Political","Goguryeo Dynasty, Prolonged Nudity, Queen Female Lead, Historical Figure, Sexual Content, Nudity, King Male Lead, Married Female Lead, Married Male Lead, Tribe, (Vote tags)",Jung Se Kyo,Lee Byung Hak,3802,939,6170,1,1
Red Swan,2024,https://mydramalist.com/745823-she,10,"Jul  3, 2024 - Jul 31, 2024","Jul  3, 2024","Jul 31, 2024",Wednesday,,49 min.,49,15+ - Teens 15 or older,7.7,4558,"Disney+, Hulu",Standard Series,"Action, Romance, Drama, Melodrama","Partially Filmed Abroad, Golfer Female Lead, Bodyguard Male Lead, Company President (CEO) Female Lead, Skilled Fighter, Rich Family, Rich Female Lead, Business Industry, Physically Strong Male Lead, Co-workers' Relationship, (Vote tags)",Park Hong Kyun,Choi Yoon Jung,3919,1749,4558,1,1
No Way Out: The Roulette,2024,https://mydramalist.com/755671-open-murder-contract,8,"Jul 31, 2024 - Aug 21, 2024","Jul 31, 2024","Aug 21, 2024",Wednesday,,46 min.,46,Not Yet Rated,7.7,2010,"Disney+, Hulu",Standard Series,"Action, Thriller, Mystery, Crime","Pastor Supporting Character, Bounty Hunter Male Lead, Ex-Convict Male Lead, Violinist Supporting Character, Politician Female Lead, Criminal Supporting Character, Criminal Male Lead, Lawyer Male Lead, Detective Male Lead, Skilled Killer, (Vote tags)",Choi Kook Hee,,4168,2645,2010,1,1
