Title,Year,Link,Episodes,Aired,Aired_start,Aired_end,AiredOn,OriginalNetwork,Duration,Duration_min,ContentRating,RatingScore,RatingVotes,WatchPlatforms,Format,Genres,Tags,Director,Screenwriter,Ranked,Popularity,Watchers,Has_dubbing_prob,Has_dubbing_pred
Show Window: The Queen's House,2021,https://mydramalist.com/696043-queen-s-house,16,"Nov 29, 2021 - Jan 18, 2022","Nov 29, 2021","Jan 18, 2022","Monday, Tuesday",,1 hr. 5 min.,65,15+ - Teens 15 or older,7.5,980,Viki,Standard Series,"Thriller, Mystery, Romance, Drama","Domestic Crime, Betrayed By A Significant Other, Mistress Female Lead, Married Life, Extramarital Affair, Brother-Sister Relationship, Dysfunctional Family, Rich Family, Rich Female Lead, Family Relationship, (Vote tags)","Kang Sol, Park Dae Hee",Han Bo Kyung,5767,4311,980,0.35,0
Hellbound,2021,https://mydramalist.com/57415-hell,6,"Nov 19, 2021","Nov 19, 2021",,Friday,,50 min.,50,18+ Restricted (violence & profanity),7.5,24126,Netflix,Standard Series,"Mystery, Horror, Drama, Supernatural","Dark Fantasy, Propaganda, Time Skip, Supernatural Phenomena, Death, Adapted From A Webtoon, Investigation, Suspense, Religion, Cult, (Vote tags)",,Choi Gyu Seok,5845,385,24126,0.85,1
Crime Puzzle,2021,https://mydramalist.com/53047-crime-puzzle,10,"Oct 29, 2021 - Nov 26, 2021","Oct 29, 2021","Nov 26, 2021",Friday,,1 hr. 10 min.,70,Not Yet Rated,7.5,980,Viki,Standard Series,"Thriller, Mystery, Psychological, Crime","Torture, Smart Male Lead, Murder, Cult, Investigation, Suspense, Death, Graphic Violence, Prison Setting, Prisoner Male Lead, (Vote tags)",Go Jae Hyun,Choi Jong Gil,5953,3618,980,0.35,0
Second Husband,2021,https://mydramalist.com/698835-second-husband,150,"Aug  9, 2021 - Apr  5, 2022","Aug  9, 2021","Apr  5, 2022","Monday, Tuesday, Wednesday, Thursday, Friday",,35 min.,35,15+ - Teens 15 or older,7.5,1030,"Amazon Prime Video, Viki",Standard Series,"Romance, Drama, Melodrama","Revenge, Wrongfully Accused, Age Gap [Real Life], Optimistic Female Lead, Soap Opera, Family Relationship, Infidelity, (Vote tags)",Kim Chil Bong,Seo Hyun Joo,6006,4106,1030,0.57,0
Convenience Store Fling,2021,https://mydramalist.com/686413-something-convenience-store,6,"Jan 23, 2021 - Feb 27, 2021","Jan 23, 2021","Feb 27, 2021",Saturday,,12 min.,12,15+ - Teens 15 or older,7.5,3282,,Standard Series,Romance,"Reverse-Harem, Web Series, Miniseries, Short Length Series, Multiple Mains, Cold Male Lead, Convenience Store Setting, Tsundere Male Lead, (Vote tags)",,,6301,2613,3282,0.25,0
"The King of Tears, Lee Bang Won",2021,https://mydramalist.com/707971-taejong-yi-bang-won,32,"Dec 11, 2021 - May  1, 2022","Dec 11, 2021","May  1, 2022","Saturday, Sunday",,60 min.,60,15+ - Teens 15 or older,7.5,268,"Amazon Prime Video, Viki",Standard Series,"Thriller, Historical, Drama, Political","Historical Fiction, Royalty, Joseon Dynasty, Suspense, Consort Supporting Character, Eunuch Supporting Character, Monk/Nun Supporting Character, King Supporting Character, Queen Supporting Character, Prince Supporting Character, (Vote tags)",Kim Hyung Il,Lee Jung Woo,6420,7131,268,0.57,0
To.Two,2021,https://mydramalist.com/716919-to-two,8,"Dec 17, 2021","Dec 17, 2021",,Friday,,15 min.,15,15+ - Teens 15 or older,7.5,1026,,Standard Series,"Thriller, Psychological, Youth","School Setting, Miniseries, Short Length Series, Web Series, Slight Romance, Student Supporting Character, Student Female Lead, Student Male Lead, Antihero Male Lead, Teenager Supporting Character, (Vote tags)",,,6432,5721,1026,0.25,0
Must You Go?,2021,https://mydramalist.com/75629-it-s-thorny,8,"Feb 26, 2021 - Mar 19, 2021","Feb 26, 2021","Mar 19, 2021",Friday,,30 min.,30,15+ - Teens 15 or older,7.4,1583,"Amazon Prime Video, Viki",Standard Series,"Music, Historical, Romance, Fantasy","Adapted From A Webtoon, Musician Female Lead, Musician Male Lead, Singer Female Lead, Singer Male Lead, Chasing A Dream, Past Life, Hardworking Male Lead, Hardworking Female Lead, Entertainment Industry, (Vote tags)",Lim Jae Kyung,"Park Sun Jae, Eo Seo Jin",6657,3619,1583,0.6,1
"Breakup Probation, A Week",2021,https://mydramalist.com/683105-a-week-delay-of-farewell,10,"Feb 22, 2021 - Feb 26, 2021","Feb 22, 2021","Feb 26, 2021",Monday,,30 min.,30,15+ - Teens 15 or older,7.4,706,Viki,Standard Series,"Romance, Drama, Fantasy","Time Travel, Break Up, Death, Cohabitation, Coma, Noble Sacrifice, Car Accident, Orphan Female Lead, Inferiority Complex, Second Chance Romance, (Vote tags)",,Min Ji,6712,5643,706,0.35,0
Love Scene Number,2021,https://mydramalist.com/72859-love-scene-number,8,"Feb  1, 2021","Feb  1, 2021",,,,60 min.,60,18+ Restricted (violence & profanity),7.4,1482,Viki,Standard Series,"Romance, Life, Drama","Multiple Mains, Break Up, Infidelity, Sexual Content, Secret Relationship, Life Lesson, Hardworking Female Lead, Smart Female Lead, Love Square, Friendship, (Vote tags)",Kim Hyung Min,Hong Kyung Sil,7062,3533,1482,0.35,0
Summer Guys,2021,https://mydramalist.com/68329-summer-guys,10,"Mar 30, 2021 - Apr 28, 2021","Mar 30, 2021","Apr 28, 2021","Tuesday, Wednesday",,30 min.,30,15+ - Teens 15 or older,7.4,1454,Viki,Standard Series,"Music, Romance, Youth, Drama","Multiple Mains, Summer Setting, Bar Setting, Childhood Friends' Relationship, Beach Setting, Seaside Setting, Bartender Male Lead, Miniseries, Web Series, Bromance, (Vote tags)",Heo Chan,Yook Si Mon,7099,3520,1454,0.35,0
"Nevertheless,",2021,https://mydramalist.com/72855-i-know-but,10,"Jun 19, 2021 - Aug 21, 2021","Jun 19, 2021","Aug 21, 2021",Saturday,,1 hr. 10 min.,70,15+ - Teens 15 or older,7.4,69039,Netflix,Standard Series,"Romance, Life, Youth, Drama","Multiple Couples, Love Triangle, Playboy Male Lead, Adapted From A Webtoon, Friends With Benefits, Inner Monologue, Sexual Content, Fast Paced Romance, Unhealthy Mains' Relationship, Flirty Male Lead, (Vote tags)","Kim Ga Ram, Jang Ji Yeon",Jung Won,7127,65,69039,0.9,1
Replay: The Moment When It Starts Again,2021,https://mydramalist.com/72613-replay,10,"Jan 26, 2021 - Feb 26, 2021","Jan 26, 2021","Feb 26, 2021","Tuesday, Friday",,14 min.,14,15+ - Teens 15 or older,7.4,2874,"Amazon Prime Video, Apple TV+, Tubi, Viki",Standard Series,"Music, Romance, Youth, Drama","Web Series, Love Triangle, Nice Female Lead, Jealousy, Multiple Mains, High School, Multiple Couples, Nice Male Lead, Unrequited Love, Friendship, (Vote tags)",,,7162,2953,2874,1,1
Please Tell Me So,2021,https://mydramalist.com/713117-please-tell-me-so,1,"Oct  8, 2021","Oct  8, 2021",,,,9 min.,9,Not Yet Rated,7.4,5198,,Drama Special,"Romance, Life","Short Film, Gay Romance, LGBTQ+, Gay Male Lead, Love At First Sight, Smoking, Secret Crush, Advertisement, Fluffy, Barista Male Lead, (Vote tags)",,,7165,2075,5198,0.25,0
Love (ft. Marriage and Divorce) Season 2,2021,https://mydramalist.com/688007-marriage-lyrics-for-divorce-music-2,16,"Jun 12, 2021 - Aug  8, 2021","Jun 12, 2021","Aug  8, 2021","Saturday, Sunday",,1 hr. 10 min.,70,15+ - Teens 15 or older,7.4,2662,Netflix,Standard Series,"Romance, Life, Drama","Emotionally Strong Female Lead, Married Life, Hardworking Female Lead, Rich Female Lead, Family Relationship, Multiple Mains, Smart Male Lead, Infidelity, Revenge, Multiple Couples, (Vote tags)",Yoo Jung Joon,Im Sung Han,7184,3301,2662,0.8,1
Cafe Midnight Season 3: The Curious Stalker,2021,https://mydramalist.com/79097-the-curious-stalker,1,"Feb 19, 2021","Feb 19, 2021",,Friday,,60 min.,60,15+ - Teens 15 or older,7.4,827,"Amazon Prime Video, Tubi",Drama Special,"Romance, Drama, Fantasy","Student Male Lead, Café Setting, Teenager Male Lead, Clairvoyance, High School, Precognition, Web Series, Coming Of Age, Character Development, (Vote tags)",Jung Yoon Soo,Won Yeong Jin,7287,5568,827,0.55,0
Hometown,2021,https://mydramalist.com/688745-hometown,12,"Sep 22, 2021 - Oct 28, 2021","Sep 22, 2021","Oct 28, 2021","Wednesday, Thursday",,1 hr. 10 min.,70,15+ - Teens 15 or older,7.4,2426,"Netflix, WeTV, iQIYI",Standard Series,"Thriller, Mystery, Horror, Drama","Investigation, Cult, Suspense, Psychological, Murder, Past And Present, Different Timelines, Trauma, Criminal Male Lead, Multiple Timelines, (Vote tags)",Park Hyun Suk,Cho Hyun Hoon,7364,2393,2426,0.9,1
100% Era,2021,https://mydramalist.com/685329-100-era,8,"Jan  7, 2021 - Feb 25, 2021","Jan  7, 2021","Feb 25, 2021",Thursday,,15 min.,15,15+ - Teens 15 or older,7.4,1228,,Standard Series,"Romance, Youth","COVID-19, Rivalry, Miniseries, High School, Web Series, Love/Hate Relationship, Mother-Daughter Relationship, Selfish Parent, Student Female Lead, Student Male Lead, (Vote tags)",,,7377,4762,1228,0.25,0
Bite Sisters,2021,https://mydramalist.com/712981-bite-sisters,10,"Oct 19, 2021 - Nov 19, 2021","Oct 19, 2021","Nov 19, 2021","Tuesday, Friday",,10 min.,10,Not Yet Rated,7.3,2347,,Standard Series,"Romance, Supernatural","Reincarnation, Social Media, Sismance, Supernatural Power, Interspecies Romance, Web Series, Short Length Series, Miniseries, Retail Industry, Business Industry, (Vote tags)",,,7458,3100,2347,0.25,0
Heartbeat Broadcasting Accident,2021,https://mydramalist.com/705667-exciting-broadcasting-accident,10,"Oct 27, 2021 - Nov 25, 2021","Oct 27, 2021","Nov 25, 2021","Wednesday, Thursday",,12 min.,12,Not Yet Rated,7.3,925,,Standard Series,Romance,"Workplace Setting, Short Length Series, Miniseries, Web Series, First Love, Love Triangle, (Vote tags)",Hong Chung Gi,,7471,5719,925,0.25,0
Reflection of You,2021,https://mydramalist.com/76617-nobody-loved,16,"Oct 13, 2021 - Dec  2, 2021","Oct 13, 2021","Dec  2, 2021","Wednesday, Thursday",,1 hr. 10 min.,70,15+ - Teens 15 or older,7.3,2580,Netflix,Standard Series,"Thriller, Mystery, Drama, Melodrama","Unhealthy Mains' Relationship, Female Rivalry, Revenge, Older Woman/Younger Man, Suspense, Domestic Crime, Writer Female Lead, Painter Female Lead, Teacher Female Lead, Unreliable Narrator, (Vote tags)",Im Hyun Wook,Yoo Bo Ra,7521,2255,2580,0.8,1
L.U.C.A.: The Beginning,2021,https://mydramalist.com/52269-luca,12,"Feb  1, 2021 - Mar  9, 2021","Feb  1, 2021","Mar  9, 2021","Monday, Tuesday",,1 hr. 15 min.,75,15+ - Teens 15 or older,7.3,5251,"Apple TV+, Tubi, Viki, WeTV, iQIYI",Standard Series,"Action, Thriller, Mystery, Sci-Fi","Human Experimentation, Hidden Past, Hidden Identity, Amnesia, Suspense, Murder, Investigation, Cult, Manhunt, Determined Female Lead, (Vote tags)",Kim Hong Seon,Chun Sung Il,7603,1417,5251,0.85,1
Peach of Time,2021,https://mydramalist.com/691545-peach-of-time,10,"Aug 30, 2021 - Sep 27, 2021","Aug 30, 2021","Sep 27, 2021","Monday, Tuesday",,27 min.,27,15+ - Teens 15 or older,7.3,6116,WeTV,Standard Series,"Romance, Youth, Drama, Supernatural","Mother-Son Relationship, Gay Romance, Investigation, Web Series, Nice Male Lead, Bilingual Male Lead, Single Mother/Father Supporting Character, Foreigner Male Lead, Gay Male Lead, Opposites Attract, (Vote tags)","Park Sun Jae, Jang Eui Soon",Yang Joo Hyun,7648,1070,6116,0.3,0
Start Up the Engine,2021,https://mydramalist.com/704313-engine-on-from-today,4,"Jun 29, 2021 - Jul 20, 2021","Jun 29, 2021","Jul 20, 2021",Tuesday,,20 min.,20,Not Yet Rated,7.3,215,,Drama Special,"Comedy, Drama","Investigation, Auto Mechanic Male Lead, Awkward Male Lead, Shy Male Lead, Slight Romance, Miniseries, Web Series, Innocent Male Lead, Secret Crush, Advertisement, (Vote tags)",Kim Dae Woong,,7754,8955,215,0.25,0
Drama Festa: Off the Course,2021,https://mydramalist.com/683923-drama-festa-i-ve-deviated-from-the-path,2,"Mar 15, 2021 - Mar 16, 2021","Mar 15, 2021","Mar 16, 2021","Monday, Tuesday",,1 hr. 5 min.,65,15+ - Teens 15 or older,7.3,210,,Drama Special,"Comedy, Drama, Family","Female Centered Plot, Single Mother Female Lead, Abandoned On Wedding Day, Miniseries, Mother-Daughter Relationship, (Vote tags)",Jang Ji Yeon,Choi Yi So,7813,14130,210,0.25,0
Jinx,2021,https://mydramalist.com/706241-jinx,10,"Oct  6, 2021 - Nov  6, 2021","Oct  6, 2021","Nov  6, 2021","Wednesday, Saturday",,20 min.,20,15+ - Teens 15 or older,7.3,448,"Amazon Prime Video, Viki",Standard Series,"Romance, Youth, Fantasy","Web Series, Crime Against Morality, Sexual Violence, Workplace Violence, False Rumor, Difficult Adulthood, Selfish Ex, Student Male Lead, School Setting, Protective Female Lead, (Vote tags)",Nam Tae Jin,Moon Woo Young,7994,5954,448,0.6,1
Mokkoji Kitchen,2021,https://mydramalist.com/710059-little-kitchen,9,"Sep  6, 2021 - Nov  8, 2021","Sep  6, 2021","Nov  8, 2021",Monday,,10 min.,10,13+ - Teens 13 or older,7.3,643,,Standard Series,"Food, Romance","Web Series, Miniseries, Student Female Lead, School Setting, Restaurant Setting, Neighbors' Relationship, Foodie Female Lead, Chef Male Lead, Young Adult Female Lead, Age Gap [Real Life], (Vote tags)",,,8036,6872,643,0.25,0
The Tasty Florida,2021,https://mydramalist.com/703033-florida-banjeom,8,"Sep 24, 2021 - Oct 15, 2021","Sep 24, 2021","Oct 15, 2021",Friday,,11 min.,11,13+ - Teens 13 or older,7.3,14187,"Viki, WeTV",Standard Series,"Romance, Youth","Web Series, Gay Romance, LGBTQ+, Friendship, Miniseries, Instant Attraction, Restaurant Setting, Gay Male Lead, Cooking, Best Friends' Relationship, (Vote tags)","Yang Kyung Hee, Yang Kyeong Hui",,8079,810,14187,0.4,0
The Moment the Heart Shines,2021,https://mydramalist.com/702613-the-moment-of-shining-heart,13,"Sep 28, 2021 - Dec 21, 2021","Sep 28, 2021","Dec 21, 2021",Tuesday,,30 min.,30,13+ - Teens 13 or older,7.3,796,,Standard Series,"Romance, Youth, Drama","Popular Male Lead, High School, Student Female Lead, Student Male Lead, School Setting, Teenager Female Lead, Teenager Male Lead, Innocent Female Lead, Social Media, Character Development, (Vote tags)",,,8085,5064,796,0.25,0
Revolutionary Sisters,2021,https://mydramalist.com/66527-revolutionary-sisters,50,"Mar 13, 2021 - Sep 18, 2021","Mar 13, 2021","Sep 18, 2021","Saturday, Sunday",,1 hr. 10 min.,70,15+ - Teens 15 or older,7.3,794,"Amazon Prime Video, Netflix, Viki",Standard Series,"Thriller, Comedy, Romance, Drama","Suspense, Rape, Death, Murder, Crime Against Morality, Sexual Violence, Public Officer Female Lead, Guitarist Male Lead, Musician Male Lead, Singer Male Lead, (Vote tags)",Lee Jin Seo,Moon Young Nam,8087,4005,794,1,1
Back to the 2008,2021,https://mydramalist.com/681629-back-to-the-2008,10,"Jan  7, 2021 - Mar 11, 2021","Jan  7, 2021","Mar 11, 2021",Thursday,,10 min.,10,Not Yet Rated,7.3,305,,Standard Series,"Romance, Youth","Short Length Series, 2000s, Miniseries, Web Series, (Vote tags)",Go Nak Gyun,,8171,9128,305,0.25,0
Cafe Midnight Season 2: Hip Up! Hit Up!,2021,https://mydramalist.com/79189-hip-up-hit-up,1,"Feb 18, 2021","Feb 18, 2021",,Thursday,,60 min.,60,15+ - Teens 15 or older,7.3,256,"Amazon Prime Video, Tubi",Drama Special,"Drama, Fantasy","Café Setting, Healing, Web Series, Character Development, Youth, (Vote tags)",Jung Yoon Soo,Won Yeong Jin,8266,9961,256,0.55,0
Part-Time Mello,2021,https://mydramalist.com/707007-part-time-melodrama,12,"Nov 17, 2021 - Dec 23, 2021","Nov 17, 2021","Dec 23, 2021","Wednesday, Thursday",,25 min.,25,15+ - Teens 15 or older,7.2,328,,Standard Series,"Comedy, Romance","Co-workers' Relationship, Restaurant Setting, Waitress Female Lead, Secondary Couple, Multiple Mains, Older Woman/Younger Man, Web Series, Love Triangle, (Vote tags)",,Baek Seung Hwa,8335,7165,328,0.25,0
Her Bucket List,2021,https://mydramalist.com/689509-her-bucketlist,10,"Dec 31, 2021","Dec 31, 2021",,Friday,,20 min.,20,15+ - Teens 15 or older,7.2,1543,"Apple TV+, Viki, WeTV",Standard Series,"Comedy, Romance, Drama","Web Series, Best Friends' Relationship, Musician Male Lead, Singer Male Lead, Miniseries, Death, Adapted From A Webtoon, Music, Friendship, (Vote tags)",,,8364,3942,1543,0.75,1
"Fly, Again",2021,https://mydramalist.com/703111-fly-back,10,"Nov 13, 2021 - Dec 15, 2021","Nov 13, 2021","Dec 15, 2021","Wednesday, Saturday",,30 min.,30,15+ - Teens 15 or older,7.2,559,"Viki, WeTV",Standard Series,"Music, Youth, Drama","Web Series, Pop Music, Student Supporting Character, Student Female Lead, Student Male Lead, School Setting, Dancer Male Lead, Idol Male Lead, Teenager Supporting Character, Teenager Female Lead, (Vote tags)","Oh Hwan Min, Oh Chung Pung",Jang Kyung Rim,8545,6085,559,0.4,0
Young Lady and Gentleman,2021,https://mydramalist.com/686231-the-gentleman-and-the-lady,52,"Sep 25, 2021 - Mar 27, 2022","Sep 25, 2021","Mar 27, 2022","Saturday, Sunday",,1 hr. 10 min.,70,15+ - Teens 15 or older,7.2,7460,"Amazon Prime Video, Netflix, Viki",Standard Series,"Comedy, Romance, Family, Melodrama","Older Man/Younger Woman, Rich Man/Poor Woman, Healing, Poor Female Lead, Age Gap [Drama Life], Childhood Acquaintance, Rich Family, Nice Male Lead, Rich Male Lead, Tutor Female Lead, (Vote tags)",Shin Chang Seok,Kim Sa Kyung,8578,1189,7460,1,1
Best Mistake Season 3,2021,https://mydramalist.com/706541-best-mistake-season-3,16,"Dec 27, 2021 - Feb 17, 2022","Dec 27, 2021","Feb 17, 2022","Tuesday, Thursday",,25 min.,25,15+ - Teens 15 or older,7.2,1532,Viki,Standard Series,"Comedy, Romance, Youth, Drama","Student Male Lead, University, Friendship, Love Triangle, Multiple Couples, Character Development, Break Up, Unrequited Love, Web Series, Ex Comes Back, (Vote tags)",,,8633,3684,1532,0.35,0
Drama Special Season 12: Be;Twin,2021,https://mydramalist.com/708979-drama-special-season-12-be-twin,1,"Nov 26, 2021","Nov 26, 2021",,Friday,,1 hr. 5 min.,65,Not Yet Rated,7.2,203,,Drama Special,"Romance, Drama, Melodrama","Identical Twin Male Lead, Brothers' Relationship, Twin Exchange, Sibling Rivalry, Identity Swap, (Vote tags)",Choi Yeon Soo,Yum Je Yi,8747,14415,203,0.25,0
The Man's Voice,2021,https://mydramalist.com/710863-that-guy-s-voice,8,"Dec 30, 2021","Dec 30, 2021",,Thursday,,32 min.,32,13+ - Teens 13 or older,7.2,1384,"Viki, iQIYI",Standard Series,"Comedy, Romance, Fantasy","Hearing Animals, Cat, Nice Male Lead, Animal, Arrogant Male Lead, Secret Crush, Bickering Mains' Relationship, Part-time Worker Female Lead, Pilot Male Lead, Shy Female Lead, (Vote tags)",,"Kim Kyung Hee, Seok Bo Bae",8798,4700,1384,0.4,0
The Road: The Tragedy of One,2021,https://mydramalist.com/684039-birth-of-tragedy,12,"Aug  4, 2021 - Sep  9, 2021","Aug  4, 2021","Sep  9, 2021","Wednesday, Thursday",,1 hr. 20 min.,80,15+ - Teens 15 or older,7.2,664,"Viki, WeTV, iQIYI",Standard Series,"Thriller, Mystery, Drama","Rich Female Lead, Popular Male Lead, Adapted From A Novel, Melodrama, Suspense, Investigation, Popular Female Lead, Extramarital Affair, Drug Usage, Infidelity, (Vote tags)",Kim No Won,Yun Hui Jeong,8898,5249,664,0.45,0
Check Out the Event,2021,https://mydramalist.com/697995-check-out-the-event,4,"Aug 14, 2021 - Sep  4, 2021","Aug 14, 2021","Sep  4, 2021",Saturday,,50 min.,50,15+ - Teens 15 or older,7.2,2053,"Amazon Prime Video, Viki, iQIYI",Standard Series,"Comedy, Romance, Youth","Flashback To Past, Miniseries, Multiple Couples, Clingy Female Lead, Summer Setting, Island Setting, Musician Male Lead, Singer Male Lead, Cheerful Female Lead, Honest Female Lead, (Vote tags)","Lee Han Joon, Kim Ji Hoon",Kim Tae Joo,9002,3665,2053,0.65,1
Tinted with You,2021,https://mydramalist.com/714169-tinted-with-you,8,"Dec 23, 2021 - Jan 14, 2022","Dec 23, 2021","Jan 14, 2022","Thursday, Friday",,12 min.,12,13+ - Teens 13 or older,7.1,11541,Viki,Standard Series,"Historical, Romance, Fantasy","Gay Romance, Time Travel, Web Series, Prince Male Lead, LGBTQ+, Joseon Dynasty, Painting, Short Length Series, Miniseries, Gay Male Lead, (Vote tags)",Ra Ha Na,,9290,917,11541,0.35,0
My Sweet Dear,2021,https://mydramalist.com/709451-my-sweet-dear,8,"Oct 21, 2021 - Nov 11, 2021","Oct 21, 2021","Nov 11, 2021",Thursday,,15 min.,15,15+ - Teens 15 or older,7.1,13461,"Viki, WeTV",Standard Series,"Food, Romance, Youth, Drama","Gay Romance, Rivals To Lovers, Miniseries, Cooking, Co-workers' Relationship, Restaurant Setting, Chef Male Lead, Gay Male Lead, Rivalry, Workplace Setting, (Vote tags)",So Joon Moon,Jang Joo Yeon,9422,757,13461,0.4,0
Our First: Seventeen,2021,https://mydramalist.com/704079-first-seventeen,10,"Jul  7, 2021 - Aug  7, 2021","Jul  7, 2021","Aug  7, 2021","Wednesday, Saturday",,10 min.,10,15+ - Teens 15 or older,7.1,213,,Standard Series,"Music, Romance, Youth","Short Length Series, Multiple Mains, Miniseries, Student Female Lead, Student Male Lead, School Setting, Teenager Female Lead, Teenager Male Lead, Innocent Female Lead, High School, (Vote tags)",Kim Soo Jung,,9606,9106,213,0.25,0
Next Door Witch J,2021,https://mydramalist.com/74393-next-door-witch-j,12,"Jun  4, 2021","Jun  4, 2021",,Friday,,11 min.,11,15+ - Teens 15 or older,7.1,1118,"Viki, WeTV",Standard Series,"Comedy, Romance, Drama","Web Series, Love Triangle, Smart Male Lead, Male Chases Female First, Emotionally Strong Female Lead, Cosmetic Industry, Vlogger Female Lead, Workplace Setting, Age Gap [Real Life], Short Length Series, (Vote tags)",Yoon Ji Hoon,,9648,4425,1118,0.4,0
Nobleman Ryu's Wedding,2021,https://mydramalist.com/694515-ryu-sun-bi-s-wedding-ceremony,8,"Apr 15, 2021 - May  6, 2021","Apr 15, 2021","May  6, 2021",Thursday,,11 min.,11,13+ - Teens 13 or older,7.1,11407,WeTV,Standard Series,"Historical, Comedy, Romance, Drama","Gay Romance, Miniseries, Cross-Dressing, Joseon Dynasty, LGBTQ+, Hidden Identity, Unrequited Love, Brother-Sister Relationship, Arranged Marriage, Cohabitation, (Vote tags)",,,9752,905,11407,0.3,0
Artificial City,2021,https://mydramalist.com/682225-duke-city,20,"Dec  8, 2021 - Feb 10, 2022","Dec  8, 2021","Feb 10, 2022","Wednesday, Thursday",,1 hr. 10 min.,70,15+ - Teens 15 or older,7,537,"Netflix, Viki",Standard Series,"Thriller, Mystery, Psychological, Drama","Emotionally Strong Female Lead, Broadcasting Industry, Father-in-law - Daughter-in-law Relationship, News Presenter Male Lead, Foundation Director Female Lead, Mother-in-law - Daughter-in-law Relationship, Married Life, Ambitious Female Lead, Popular Male Lead, Conglomerate, (Vote tags)",Jun Chang Geun,Son Se Dong,10017,4886,537,0.87,1
Love Twist,2021,https://mydramalist.com/712413-love-twist,103,"Dec 13, 2021 - May 20, 2022","Dec 13, 2021","May 20, 2022","Monday, Tuesday, Wednesday, Thursday, Friday",,35 min.,35,15+ - Teens 15 or older,7,240,Viki,Standard Series,"Family, Melodrama","Family Relationship, Love Triangle, (Vote tags)",Kim Won Yong,Lee Eun Joo,10068,8856,240,0.32,0
Love in Black Hole,2021,https://mydramalist.com/703041-love-in-black-hole,12,"Sep 10, 2021 - Oct 16, 2021","Sep 10, 2021","Oct 16, 2021","Friday, Sunday",,10 min.,10,15+ - Teens 15 or older,7,852,"Viki, WeTV",Standard Series,"Romance, Youth, Sci-Fi, Fantasy","Student Female Lead, Student Male Lead, School Setting, Childhood Friends' Relationship, Young Adult Female Lead, Young Adult Male Lead, Short Length Series, Honest Male Lead, Time Rift, Cold Male Lead, (Vote tags)",Hong Chung Gi,,10069,5663,852,0.4,0
Not Found Love,2021,https://mydramalist.com/713831-can-t-find-the-answer,10,"Nov  9, 2021 - Dec  9, 2021","Nov  9, 2021","Dec  9, 2021","Tuesday, Thursday",,15 min.,15,Not Yet Rated,7,186,,Standard Series,Romance,"Ex Comes Back, Best Friends' Relationship, Short Length Series, Break Up, Reverse-Harem, Miniseries, Web Series, Friendship, (Vote tags)",,,10177,10931,186,0.25,0
The Guys I Want to Catch,2021,https://mydramalist.com/705677-the-guys-i-want-to-catch,10,"Aug 30, 2021 - Nov  1, 2021","Aug 30, 2021","Nov  1, 2021",Monday,,16 min.,16,15+ - Teens 15 or older,7,203,,Standard Series,Drama,"Web Series, Short Length Series, Miniseries, Bromance, Friendship, (Vote tags)",,,10200,8209,203,0.25,0
Peng,2021,https://mydramalist.com/705385-fang,10,"Oct  7, 2021 - Nov  5, 2021","Oct  7, 2021","Nov  5, 2021","Thursday, Friday",,19 min.,19,15+ - Teens 15 or older,7,2171,Viki,Standard Series,"Comedy, Romance","Multiple Mains, Ex Comes Back, Roommates' Relationship, Best Friends' Relationship, Company President (CEO) Male Lead, Short Length Series, Fashion Industry, Modeling, Stalking, Reverse-Harem, (Vote tags)",Baek Min Hee,Han Soo Ji,10216,2887,2171,0.35,0
Love Refresh,2021,https://mydramalist.com/704075-love-refresh,3,"Jun 23, 2021 - Jul  7, 2021","Jun 23, 2021","Jul  7, 2021",Wednesday,,8 min.,8,15+ - Teens 15 or older,7,459,,Drama Special,"Comedy, Romance","Friends To Lovers, Advertisement, Miniseries, Web Series, Friendship, Screenwriter Male Lead, Screenwriter Female Lead, Short Length Series, Successful Female Lead, (Vote tags)",Baek Min Hee,,10291,7570,459,0.25,0
How to Be Thirty,2021,https://mydramalist.com/40131-born-in-1985,15,"Feb 23, 2021 - Apr 13, 2021","Feb 23, 2021","Apr 13, 2021","Tuesday, Saturday",,20 min.,20,15+ - Teens 15 or older,7,3804,"Viki, iQIYI",Standard Series,"Comedy, Romance, Drama","Web Series, Sismance, Unhealthy Mains' Relationship, Older Woman/Younger Man, First Love, Adapted From A Webtoon, Eccentric Female Lead, Emotionally Strong Female Lead, Broadcasting Industry, Publishing House Setting, (Vote tags)",Oh Ki Hwan,,10309,1902,3804,0.4,0
Love (ft. Marriage and Divorce),2021,https://mydramalist.com/71059-untitled-im-sung-han-project,16,"Jan 23, 2021 - Mar 14, 2021","Jan 23, 2021","Mar 14, 2021","Saturday, Sunday",,1 hr. 10 min.,70,15+ - Teens 15 or older,6.9,3858,Netflix,Standard Series,"Mystery, Romance, Drama","Infidelity, Multiple Couples, Multiple Mains, Emotionally Strong Female Lead, Radio Station Setting, Difficult Adulthood, Broadcasting Industry, Betrayed By A Significant Other, Student Supporting Character, School Setting, (Vote tags)",Yoo Jung Joon,Im Sung Han,10512,2159,3858,0.8,1
Dramaworld Season 2,2021,https://mydramalist.com/53255-dramaworld-2,10,"Apr  2, 2021 - May 14, 2021","Apr  2, 2021","May 14, 2021","Friday, Saturday",,35 min.,35,15+ - Teens 15 or older,6.9,223,"Amazon Prime Video, iQIYI",Standard Series,"Comedy, Romance, Drama, Supernatural","Student Female Lead, Fan Female Lead, Teenager Female Lead, Fictional World, Chasing A Dream, Set In A Foreign Country, Miniseries, High School, (Vote tags)",,,10738,5833,223,0.55,0
